{
  "schema_version": 2,
  "kind": "effectiveness-v2-protocol",
  "baseline_revision": "0f99603a603b0243345e7320a52702df67a2194e",
  "candidate_revision": "08591213f562073f9ddb0ff9012ec0e3f8ed09c2",
  "strata": [
    "greenfield-direction",
    "brownfield-repair",
    "accessibility-safety",
    "verbal-copy",
    "orchestration-gates",
    "render-integration"
  ],
  "scenarios_per_stratum": 2,
  "seeds": [
    101,
    202
  ],
  "comparison_units": 24,
  "generation_calls": 48,
  "production_judgments": 96,
  "anchor_judgments": 16,
  "max_external_calls": 160,
  "incremental_spend_cap_usd": 0,
  "retry_policy": "none",
  "exclusions": [],
  "family_quorum": 2,
  "judge_identities_per_family": 2,
  "candidate_preference_floor": 18,
  "scenario_majority_floor": 8,
  "absolute_mean_floor": 4,
  "dimension_floor": 3,
  "human_calibration_claimed": false,
  "randomization_commitment_sha256": "aaaaaaaaaaaaaaaaaaaaaaaaaaaaaaaaaaaaaaaaaaaaaaaaaaaaaaaaaaaaaaaa",
  "packet_validator_version": "effectiveness-v2-packet-policy-1",
  "packet_validator_sha256": "6a8fa4f7c6f70ebe2f9cb22102131b50f46a037cccf18a584e4cabbbc5d66b99"
}
